{
  "$schema": "https://json-schema.org/draft/2020-12/schema",
  "$id": "https://slove-context.local/contracts/approval-decision.schema.json",
  "title": "Approval Decision / 批准裁决",
  "description": "人类主编对通过校验的候选变更作出的批准或拒绝（节点 0.1 / 0.2 / 0.3）。这是人工主编动作，不是 Validate。decision 只有批准或拒绝，绝不含自动批准。created_by 必须是人工主编。本对象不写 Canon：批准本身不提交；成为 Canon 事实还须主编另一次人工提交。模型、实现 bot、验收 bot、Agent 不得作为批准者或 Canon 写入者。",
  "type": "object",
  "additionalProperties": false,
  "required": [
    "schema_version",
    "id",
    "project_id",
    "created_at",
    "created_by",
    "candidate_change_id",
    "decision"
  ],
  "properties": {
    "schema_version": { "$ref": "#/$defs/schema_version" },
    "id": { "$ref": "#/$defs/uuid" },
    "project_id": { "$ref": "#/$defs/project_id" },
    "created_at": { "$ref": "#/$defs/iso8601_utc" },
    "created_by": { "$ref": "#/$defs/human_editor" },
    "candidate_change_id": {
      "$ref": "#/$defs/uuid",
      "description": "被裁决的候选变更。该候选须已处于待主编裁决；未通过校验者不能进入批准。"
    },
    "decision": { "$ref": "#/$defs/decision" },
    "reason": {
      "type": "string",
      "description": "主编给出的批准或拒绝说明。不是自动生成的批准。"
    }
  },
  "$defs": {
    "schema_version": {
      "type": "string",
      "minLength": 1,
      "description": "本契约的版本字符串（节点 0.4）。"
    },
    "uuid": {
      "type": "string",
      "format": "uuid",
      "description": "UUID 字符串。"
    },
    "project_id": {
      "type": "string",
      "format": "uuid",
      "description": "唯一故事项目的标识。MVP 只有一个小说项目；本字段不是多项目数组，多项目不是 MVP 正常行为。"
    },
    "iso8601_utc": {
      "type": "string",
      "format": "date-time",
      "pattern": "^[0-9]{4}-[0-9]{2}-[0-9]{2}T[0-9]{2}:[0-9]{2}:[0-9]{2}(\\.[0-9]+)?Z$",
      "description": "ISO 8601 UTC 时间戳，必须以 Z 结尾。"
    },
    "human_editor": {
      "type": "string",
      "minLength": 1,
      "description": "人工主编（创作者兼主编）的 id 或姓名。批准候选变更的唯一允许触发者。禁止系统、生成 Agent、审校 Agent、模型、实现 bot、验收 bot。"
    },
    "decision": {
      "type": "string",
      "description": "人类裁决。仅批准或拒绝。不存在自动批准、auto、或系统代批。本裁决不写 Canon。",
      "oneOf": [
        { "const": "Approve", "description": "批准（肯定裁决）。只记录批准；Canon 尚未改。提交是另一次人工动作。" },
        { "const": "Reject", "description": "拒绝（否定裁决）。不提交，不写 Canon。" }
      ]
    }
  }
}
