{
  "schema_version": "0.4.0",
  "id": "99999999-9999-4999-8999-999999999999",
  "project_id": "11111111-1111-4111-8111-111111111111",
  "created_at": "2026-08-18T02:50:00Z",
  "created_by": "主编",
  "candidate_change_id": "66666666-6666-4666-8666-666666666666",
  "decision": "Approve",
  "reason": "与已写定规格不冲突；仍须主编另一次提交才会改 Canon。"
}
